{
  "manifestVersion": "0",
  "adapterId": "non-revocable-target",
  "targetType": "generic",
  "targetVersion": "0",
  "adapterVersion": "0",
  "acceptsFipVersions": [
    "0.2"
  ],
  "kinds": [
    "filesystem",
    "service",
    "api",
    "process",
    "executable",
    "model",
    "inference-provider",
    "credential",
    "device",
    "message-channel",
    "datastore"
  ],
  "operations": [
    "read",
    "write",
    "execute",
    "connect",
    "invoke",
    "create",
    "modify",
    "delete",
    "publish",
    "subscribe",
    "query",
    "command"
  ],
  "locatorForms": [
    "path",
    "host",
    "port",
    "uri",
    "serviceId",
    "executableId",
    "modelId",
    "deviceId",
    "channelId"
  ],
  "protocolFamilies": [
    "http",
    "mcp",
    "graphql",
    "websocket",
    "json-rpc"
  ],
  "protocolConstraints": [
    "http.method",
    "http.path"
  ],
  "effects": [
    "permit",
    "deny",
    "require-approval",
    "audit-only"
  ],
  "auditStrengths": [
    "none",
    "target-native",
    "correlated"
  ],
  "compositions": [
    "allOf",
    "anyOf"
  ],
  "approval": {
    "actionGate": true,
    "policyMutation": false
  },
  "precision": {
    "filesystemOperations": "exact",
    "networkHost": "exact",
    "httpMethod": true,
    "httpPath": true,
    "modelId": true,
    "credentialDisclosures": [
      "none",
      "proxy-mediated",
      "process-visible"
    ],
    "traceCorrelation": true
  },
  "substrate": [],
  "dangerousDefaults": [],
  "capabilities": [
    {
      "capabilityId": "filesystem",
      "kinds": [
        "filesystem"
      ],
      "lifetimes": [
        "establishment-bound"
      ]
    },
    {
      "capabilityId": "process",
      "kinds": [
        "process",
        "executable"
      ],
      "lifetimes": [
        "establishment-bound"
      ]
    },
    {
      "capabilityId": "network",
      "kinds": [
        "service",
        "api",
        "inference-provider"
      ],
      "lifetimes": [
        "establishment-bound"
      ]
    },
    {
      "capabilityId": "credential",
      "kinds": [
        "credential"
      ],
      "lifetimes": [
        "establishment-bound"
      ]
    },
    {
      "capabilityId": "model",
      "kinds": [
        "model"
      ],
      "lifetimes": [
        "establishment-bound"
      ]
    },
    {
      "capabilityId": "other",
      "kinds": [
        "device",
        "message-channel",
        "datastore"
      ],
      "lifetimes": [
        "establishment-bound"
      ]
    }
  ]
}
